{
  "$schema": "https://json-schema.org/draft/2020-12/schema",
  "$id": "https://curioler.org/schemas/study.schema.json",
  "title": "Curioler Research Study",
  "type": "object",
  "additionalProperties": false,
  "required": [
    "pmid",
    "doi",
    "title",
    "year",
    "journal",
    "authors",
    "study_type",
    "domain",
    "trust_tier",
    "trust_tier_label",
    "easy_explainer",
    "participants",
    "age_range",
    "age_min",
    "age_max",
    "age_unit",
    "diagnosis",
    "co_occurring_conditions",
    "intervention",
    "duration",
    "primary_outcomes",
    "secondary_outcomes",
    "limitations",
    "clinical_implications",
    "abstract",
    "conclusion",
    "mesh_terms",
    "keywords",
    "source_url",
    "created_at",
    "last_updated"
  ],
  "properties": {
    "pmid": { "type": "string", "pattern": "^[0-9]+$" },
    "doi": { "type": ["string", "null"] },
    "title": { "type": "string", "minLength": 1 },
    "year": { "type": ["integer", "null"], "minimum": 1800 },
    "journal": { "type": ["string", "null"] },
    "authors": { "type": "array", "items": { "type": "string" } },
    "study_type": { "type": ["string", "null"] },
    "domain": {
      "type": "string",
      "enum": ["adaptive", "behaviour", "cognitive", "communication", "general", "motor", "sensory", "social"]
    },
    "trust_tier": { "type": "integer", "minimum": 1, "maximum": 4 },
    "trust_tier_label": { "type": "string", "minLength": 1 },
    "easy_explainer": {
      "type": "object",
      "additionalProperties": false,
      "required": ["design", "size", "duration", "conclusion", "not_stated", "disclaimer"],
      "properties": {
        "design": { "type": "string", "minLength": 1 },
        "size": { "type": "string", "minLength": 1 },
        "duration": { "type": ["string", "null"] },
        "conclusion": { "type": ["string", "null"] },
        "not_stated": { "type": "array", "items": { "type": "string" } },
        "disclaimer": { "type": "string", "minLength": 1 }
      }
    },
    "participants": { "type": ["integer", "string", "null"] },
    "age_range": { "type": ["string", "null"] },
    "age_min": { "type": ["number", "null"], "minimum": 0 },
    "age_max": { "type": ["number", "null"], "minimum": 0 },
    "age_unit": { "type": ["string", "null"], "enum": ["years", "months", "weeks", "days", null] },
    "diagnosis": { "type": ["string", "null"] },
    "co_occurring_conditions": { "type": "array", "items": { "type": "string" } },
    "intervention": { "type": ["string", "null"] },
    "duration": { "type": ["string", "null"] },
    "primary_outcomes": { "type": "array", "items": { "type": "string" } },
    "secondary_outcomes": { "type": "array", "items": { "type": "string" } },
    "limitations": { "type": "array", "items": { "type": "string" } },
    "clinical_implications": { "type": ["string", "null"] },
    "abstract": { "type": ["string", "null"] },
    "conclusion": { "type": ["string", "null"] },
    "mesh_terms": { "type": "array", "items": { "type": "string" } },
    "keywords": { "type": "array", "items": { "type": "string" } },
    "source_url": { "type": "string", "pattern": "^https://pubmed.ncbi.nlm.nih.gov/[0-9]+/?$" },
    "created_at": { "type": "string" },
    "last_updated": { "type": "string" }
  }
}
