{
  "abstract": "BACKGROUND: Autism Spectrum Disorders (ASD) are neurodevelopmental disorders with highly heterogeneous clinical profiles, outcomes and care pathways. Linking health administrative databases with cohort studies is an excellent opportunity to study healthcare utilisation by ASD patients. Optimisation of linkage should maximise the linkage rate and minimise potential errors and biases to ensure high quality analyses and the absence of bias. This study aims to describe the linkage strategy between the French national health database (SNDS) and the ELENA cohort database, and to provide advice on optimizing linkage quality.\nMETHODS: The ELENA cohort includes 876 children with a confirmed diagnosis of ASD between 2013 and 2019. The SNDS contains all healthcare services reimbursed by health insurance schemes. We performed deterministic matching on the reference sample and evaluated deterministic and probabilistic approaches on another sample. Performance was assessed using the matching rate and comparison between matched and unmatched groups.\nRESULTS: We matched 96 % of the reference sample and 53 % of the other sample using either deterministic or probabilistic approach, resulting in a total match rate of 79 % with deterministic or mixed approach. The mixed approach minimized selection bias, producing a linked dataset of 692 children with ASD whose characteristics were comparable to those of the unmatched sample. Probabilistic weighting showed that hospitalization dates were the most discriminating variables for matching.\nCONCLUSIONS: The mixed linkage strategy optimised match quality while limiting bias, confirming the feasibility of linking clinical ASD cohort data to the SNDS and strengthening future research on healthcare use among children with autism.\nTRIAL REGISTRATION NUMBER: NCT04292522.",
  "age_max": null,
  "age_min": null,
  "age_range": null,
  "age_unit": null,
  "authors": [
    "Julie Loubersac",
    "Marie-Christine Picot",
    "Fabien Belloc",
    "Marjorie Boussac",
    "Amaria Baghdadli"
  ],
  "clinical_implications": "The mixed linkage strategy optimised match quality while limiting bias, confirming the feasibility of linking clinical ASD cohort data to the SNDS and strengthening future research on healthcare use among children with autism.",
  "co_occurring_conditions": [],
  "conclusion": "The mixed linkage strategy optimised match quality while limiting bias, confirming the feasibility of linking clinical ASD cohort data to the SNDS and strengthening future research on healthcare use among children with autism.\nTRIAL REGISTRATION NUMBER: NCT04292522.",
  "created_at": "2026-08-31T05:13:47Z",
  "diagnosis": "Autism Spectrum Disorder",
  "doi": "10.1016/j.jeph.2026.203349",
  "domain": "general",
  "duration": null,
  "easy_explainer": {
    "conclusion": "The researchers concluded: \"The mixed linkage strategy optimised match quality while limiting bias, confirming the feasibility of linking clinical ASD cohort data to the SNDS and strengthening future research on healthcare use among children with autism. TRIAL REGISTRATION NUMBER: NCT04292522.\"",
    "design": "This was an observational study — researchers watched what happened rather than assigning treatments. It can show that two things happen together, but it cannot show that one caused the other.",
    "disclaimer": "This is a plain-language summary of one paper's abstract, not medical advice. Talk to your child's clinician before changing anything.",
    "duration": null,
    "not_stated": [
      "the ages of the people who took part",
      "how long the study ran"
    ],
    "size": "It involved 876 people, which is a large group for autism research and makes the findings steadier."
  },
  "intervention": "Cohort",
  "journal": "Journal of epidemiology and population health",
  "keywords": [
    "Autism spectrum disorder",
    "Cohort",
    "Deterministic matching",
    "Probabilistic matching",
    "SNDS"
  ],
  "last_updated": "2026-08-31T13:10:30Z",
  "limitations": [
    "Extracted from abstract only; full-text methods and risk-of-bias details were not reviewed."
  ],
  "mesh_terms": [
    "Child",
    "Child, Preschool",
    "Female",
    "Humans",
    "Male",
    "Autism Spectrum Disorder",
    "Cohort Studies",
    "Databases, Factual",
    "France",
    "Medical Record Linkage"
  ],
  "participants": 876,
  "pmid": "42492413",
  "primary_outcomes": [
    "We matched 96 % of the reference sample and 53 % of the other sample using either deterministic or probabilistic approach, resulting in a total match rate of 79 % with deterministi…"
  ],
  "secondary_outcomes": [],
  "source_url": "https://pubmed.ncbi.nlm.nih.gov/42492413/",
  "study_type": "Observational Study",
  "title": "Linking the national health database to the cohort of children with autism spectrum disorders: a mixed approach to optimising the linkage.",
  "trust_tier": 3,
  "trust_tier_label": "Observational Study",
  "year": 2026
}
