{
  "abstract": "Naturalistic Developmental Behavioral Interventions (NDBIs) effectively improve developmental, social, and adaptive outcomes in autistic children, with caregiver involvement further enhancing treatment effects. Although one-on-one NDBI programs are strongly supported by evidence, their reliance on high staff-to-child ratios and certified therapists limits scalability. Group-based NDBI models may represent a more feasible and cost-effective alternative, particularly when implemented with open-access fidelity frameworks and active caregiver participation. This pilot randomized controlled trial compared a caregiver-assisted, group-based NDBI program with a therapist-delivered one-on-one NDBI program in autistic children aged 2 to 5 years. Both interventions were administered twice weekly for 12 weeks, with fidelity monitored using the NDBI Fidelity (NDBI-Fi). Forty autistic children were enrolled, and 38 children were included in the final analyses. Both groups showed significant improvements over time in verbal development, social interaction, adaptive functioning, autistic symptoms, problem behaviors, and caregiver stress. A significant time-by-group interaction was observed for nonverbal development, with significant gains in the one-on-one NDBI group but not in the group-based condition. These preliminary findings suggest that a structured, caregiver-assisted group-based NDBI model that integrates caregivers' assistance, maintains intervention fidelity, and reduces staffing demands is feasible and associated with changes over time, indicating its potential as a scalable intervention approach.Clinical trial registry: https://clinicaltrials.gov/study/NCT06221943Lay AbstractEarly intervention can help young autistic children improve communication, learning, social skills, and daily functioning. One widely used approach, Naturalistic Developmental Behavioral Intervention (NDBI), teaches skills through play and everyday activities, while actively involving caregivers. However, traditional NDBI is typically delivered one-on-one by trained therapists, which can be costly and difficult for many families to access. This study evaluated a new, group-based NDBI program in which small groups of young children and their caregivers learned together with therapist guidance. Thirty-eight autistic children aged 2 to 5 years received two sessions per week over 12 weeks, with 19 receiving the group program and 19 receiving the therapist-delivered one-on-one intervention. Children in both groups showed meaningful improvements in language, social interaction, adaptive functioning, autistic symptoms, and behaviors. Caregivers in both groups also reported feeling less stressed. The group-based model was feasible and acceptable while supporting positive developmental changes. However, significant improvements in nonverbal development were observed only in the one-on-one intervention group. Overall, these findings suggest that caregiver-assisted group-based NDBI is a promising and more accessible early intervention option, especially in settings where individualized therapy is limited or difficult to obtain.",
  "age_max": 5,
  "age_min": 2,
  "age_range": "2-5 years",
  "age_unit": "years",
  "authors": [
    "Guan-Jye Seng",
    "Ji-Yu Lin",
    "Wei-Lieh Huang",
    "Hsin-Yu Lai",
    "Wei-Chih Kao",
    "Hao-Ling Chen",
    "Susan Shur-Fen Gau"
  ],
  "clinical_implications": "May be relevant to two sessions per week over 12 weeks, with 19 receiving the group program and 19 receiving the therapist-delive in Autism Spectrum Disorder, based on abstract-reported findings.",
  "co_occurring_conditions": [],
  "conclusion": null,
  "created_at": "2026-08-31T05:13:47Z",
  "diagnosis": "Autism Spectrum Disorder",
  "doi": "10.1177/13623613261462574",
  "domain": "social",
  "duration": "12 weeks",
  "easy_explainer": {
    "conclusion": "The abstract does not include a conclusions section, so this page does not state what the researchers concluded.",
    "design": "This was a randomised controlled trial — people were assigned to treatments by chance, which is the most reliable way to tell whether a treatment itself caused a change.",
    "disclaimer": "This is a plain-language summary of one paper's abstract, not medical advice. Talk to your child's clinician before changing anything.",
    "duration": "The study ran for 12 weeks. That is a short window, so it says nothing about whether the effects last.",
    "not_stated": [],
    "size": "It involved 40 people — a modest group, enough to be interesting but not enough to settle a question on its own."
  },
  "intervention": "two sessions per week over 12 weeks, with 19 receiving the group program and 19 receiving the therapist-delive",
  "journal": "Autism : the international journal of research and practice",
  "keywords": [
    "autism",
    "group-based delivery",
    "naturalistic developmental behavioral intervention",
    "preliminary efficacy"
  ],
  "last_updated": "2026-08-31T13:10:30Z",
  "limitations": [
    "limited or difficult to obtain"
  ],
  "mesh_terms": [
    "Humans",
    "Child, Preschool",
    "Pilot Projects",
    "Female",
    "Male",
    "Feasibility Studies",
    "Behavior Therapy",
    "Caregivers",
    "Autistic Disorder",
    "Treatment Outcome",
    "Psychotherapy, Group"
  ],
  "participants": 40,
  "pmid": "42494078",
  "primary_outcomes": [],
  "secondary_outcomes": [],
  "source_url": "https://pubmed.ncbi.nlm.nih.gov/42494078/",
  "study_type": "Randomized Controlled Trial",
  "title": "Feasibility and Preliminary Efficacy of a Caregiver-Assisted Group-Based Naturalistic Developmental Behavioral Intervention Program for Autistic Preschoolers: A Pilot Randomized Controlled Trial.",
  "trust_tier": 2,
  "trust_tier_label": "Randomized Controlled Trial",
  "year": 2026
}
