{
  "abstract": "Chromosome 16p11.2 deletion syndrome is a genetic syndrome that includes difficulties in speech, language, and motor coordination. Arbaclofen, a selective GABA-B receptor agonist, has improved motor functioning and memory in mouse models. Prior clinical trials of arbaclofen in fragile X syndrome and autism spectrum disorder suggested benefit for social communication. L16hthouse (NCT04271332) is a multi-site, double-blind, randomized, placebo-controlled phase 2 trial to evaluate safety, efficacy, and tolerability of arbaclofen compared in 60 youths with 16p11.2 deletion syndrome (5 to 17:11 years) randomized on a 1:1 ratio. Primary outcomes included speech articulation, measured by the Goldman Fristoe Test of Articulation 3 (GFTA-3). Secondary outcomes included objective dysarthria indices, memory, motor control, and cognitive function, assessed with both standardized clinical measures and novel, computer-based assessments with automated scoring. Exploratory outcomes included attention, autism traits, and electrophysiological responses. L16hthouse is the first randomized trial in 16p11.2 deletion syndrome and uses an array of novel outcome measures to assess potential benefit in this population. In addition to providing potential insights about the safety, efficacy, and tolerability of arbaclofen, L16hthouse will provide an initial assessment of how these developmental outcome measures perform in a clinical trial across a broad age range.Clinical trial registration number: NCT04271332; 2020-02-13.\nThe methods are described for a multi-site, double-blind, randomized controlled Phase 2 trial to evaluate the safety, efficacy, and tolerability of arbaclofen for youth with 16p11.2 deletion syndrome. The primary outcome measure was speech articulation, a key difficulty for youth with 16p11.2 deletion syndrome. The outcomes of this trial, combined with the parallel Canadian ARBA and European AIMS-CT-01 trials, will contribute to the evidence base of arbaclofen as a treatment for neurological and psychiatric conditions.",
  "age_max": null,
  "age_min": null,
  "age_range": null,
  "age_unit": null,
  "authors": [
    "Hannah M Rea",
    "Julia T Mattson",
    "Vardan Arutiunian",
    "Alyssa Verdes",
    "Suvekcha Bhattachan",
    "Megha Santhosh",
    "Abigail Garcia",
    "Anika Ajwani",
    "Meaghan Bowen",
    "Susan Faja",
    "Ellen Hanson",
    "Katherine Pawlowski",
    "Robin P Kochel",
    "Lisa Prock",
    "Jeremy Veenstra-VanderWeele",
    "Karen Walton-Bowen",
    "Adam Vogel",
    "Angela Morgan",
    "Sara Jane Webb",
    "Paul P Wang"
  ],
  "clinical_implications": "May be relevant to 16p11.2 deletion syndrome in Autism Spectrum Disorder, based on abstract-reported findings.",
  "co_occurring_conditions": [
    "Chromosome Disorders",
    "Intellectual Disability"
  ],
  "conclusion": null,
  "created_at": "2026-08-10T07:28:06Z",
  "diagnosis": "Autism Spectrum Disorder",
  "doi": "10.1080/14737175.2026.2655767",
  "domain": "general",
  "duration": null,
  "easy_explainer": {
    "conclusion": "The abstract does not include a conclusions section, so this page does not state what the researchers concluded.",
    "design": "This was a randomised controlled trial — people were assigned to treatments by chance, which is the most reliable way to tell whether a treatment itself caused a change.",
    "disclaimer": "This is a plain-language summary of one paper's abstract, not medical advice. Talk to your child's clinician before changing anything.",
    "duration": null,
    "not_stated": [
      "the ages of the people who took part",
      "how long the study ran"
    ],
    "size": "The number of people who took part is not stated in this record, so the result cannot be judged on size."
  },
  "intervention": "16p11.2 deletion syndrome",
  "journal": "Expert review of neurotherapeutics",
  "keywords": [
    "16p11.2 deletion syndrome",
    "arbaclofen",
    "language",
    "randomized controlled trial",
    "speech",
    "youth"
  ],
  "last_updated": "2026-08-31T13:10:30Z",
  "limitations": [
    "Extracted from abstract only; full-text methods and risk-of-bias details were not reviewed."
  ],
  "mesh_terms": [
    "Humans",
    "Chromosome Disorders",
    "Child",
    "Chromosomes, Human, Pair 16",
    "Chromosome Deletion",
    "Double-Blind Method",
    "Precision Medicine",
    "Adolescent",
    "Intellectual Disability",
    "Female",
    "Child, Preschool",
    "Male",
    "Baclofen",
    "GABA-B Receptor Agonists",
    "Autistic Disorder"
  ],
  "participants": null,
  "pmid": "42080302",
  "primary_outcomes": [],
  "secondary_outcomes": [],
  "source_url": "https://pubmed.ncbi.nlm.nih.gov/42080302/",
  "study_type": "Randomized Controlled Trial",
  "title": "Rationale and study design for the first precision medicine randomized placebo-controlled trial in the 16p11.2 deletion syndrome.",
  "trust_tier": 2,
  "trust_tier_label": "Randomized Controlled Trial",
  "year": 2026
}
