{
  "abstract": "BACKGROUND: The placebo effect is established in clinical trials, but for paediatric research, questions remain about how to best manage its influence. Within the autism field, data on these issues is sparse. This is particularly important in the oxytocin field where placebo responses are thought to play an important role. This study reports on data from the single-blind, placebo lead-in phase of a randomised controlled trial (RCT) to investigate the placebo response and its relationship to treatment response in autistic children.\nMETHODS: Eighty-seven autistic children aged 3-12 years (M = 7.27; SD = 2.69; 85.1% male) were consecutively recruited into a multi-site RCT evaluating the efficacy of oxytocin for improving social responsiveness. Participants underwent a 3-week, single-blind placebo lead-in before randomisation into a 12-week double-blind treatment phase (oxytocin, n = 45; placebo, n = 42). The Social Responsiveness Scale, 2nd Edition (SRS-2) Total Raw Score was used to measure change from baseline to post-placebo lead-in. A ≥10-point improvement defined placebo responders.\nRESULTS: Nearly half the sample (n = 42, 48.3%) were identified as placebo responders during the lead-in phase, showing a clinically significant degree of change on the SRS-2. Caregiver treatment guess did not significantly impact the placebo response (p = .534). Placebo response was associated with greater symptom severity (r's > -.23; p-values < .037) and higher cognitive ability (r = -.35, p = .004). Smaller placebo responses during the lead-in phase were associated with larger responses during active treatment in participants receiving oxytocin (r = -.36, p = .017). Placebo responses during the lead-in phase were observed across all caregiver-reported measures (Cohen's d = .19-.65).\nCONCLUSIONS: This study provides important information about placebo effects and placebo lead-in designs for clinical trials in the autism field. We show widespread clinically significant improvement during placebo lead-in, utility of identifying placebo responders for informing clinical trial analyses, similarities in symptom measure effect sizes for placebo effects, and a lack of influence of caregiver beliefs on placebo responses.",
  "age_max": 12,
  "age_min": 3,
  "age_range": "3-12 years",
  "age_unit": "years",
  "authors": [
    "Kelsie A Boulton",
    "Rinku Thapa",
    "Yun Ju Song",
    "Andrew J O Whitehouse",
    "Marilena M DeMayo",
    "Simon G Gregory",
    "Izabella Pokorski",
    "Joanna Granich",
    "Zahava Ambarchi",
    "John Wray",
    "Emma E Thomas",
    "Ian B Hickie",
    "Adam J Guastella"
  ],
  "clinical_implications": "This study provides important information about placebo effects and placebo lead-in designs for clinical trials in the autism field.",
  "co_occurring_conditions": [],
  "conclusion": "This study provides important information about placebo effects and placebo lead-in designs for clinical trials in the autism field. We show widespread clinically significant improvement during placebo lead-in, utility of identifying placebo responders for informing clinical trial analyses, similarities in symptom measure effect sizes for placebo effects, and a lack of influence of caregiver beliefs on placebo responses.",
  "created_at": "2026-08-10T07:28:06Z",
  "diagnosis": "Autism Spectrum Disorder",
  "doi": "10.1111/jcpp.70116",
  "domain": "general",
  "duration": "3-week",
  "easy_explainer": {
    "conclusion": "The researchers concluded: \"This study provides important information about placebo effects and placebo lead-in designs for clinical trials in the autism field. We show widespread clinically significant improvement during placebo lead-in, utility of identifying placebo responders for informing clinical trial analyses, similarities in symptom measure effect sizes for placebo effects, and a lack of influence of caregiver beliefs on placebo responses.\"",
    "design": "This was a randomised controlled trial — people were assigned to treatments by chance, which is the most reliable way to tell whether a treatment itself caused a change.",
    "disclaimer": "This is a plain-language summary of one paper's abstract, not medical advice. Talk to your child's clinician before changing anything.",
    "duration": "The study ran for 3-week. That is a short window, so it says nothing about whether the effects last.",
    "not_stated": [],
    "size": "It involved 87 people — a modest group, enough to be interesting but not enough to settle a question on its own."
  },
  "intervention": "oxytocin",
  "journal": "Journal of child psychology and psychiatry, and allied disciplines",
  "keywords": [
    "Treatment",
    "anxiety",
    "autism",
    "oxytocin",
    "social interaction"
  ],
  "last_updated": "2026-08-31T13:10:30Z",
  "limitations": [
    "Extracted from abstract only; full-text methods and risk-of-bias details were not reviewed."
  ],
  "mesh_terms": [
    "Humans",
    "Oxytocin",
    "Male",
    "Child",
    "Child, Preschool",
    "Female",
    "Administration, Intranasal",
    "Placebo Effect",
    "Single-Blind Method",
    "Autistic Disorder",
    "Autism Spectrum Disorder",
    "Outcome Assessment, Health Care",
    "Double-Blind Method"
  ],
  "participants": 87,
  "pmid": "41550040",
  "primary_outcomes": [
    "social responsiveness",
    "Social Responsiveness Scale",
    "SRS-2) Total Raw Score was used to measure change from baseline",
    "SRS-2"
  ],
  "secondary_outcomes": [],
  "source_url": "https://pubmed.ncbi.nlm.nih.gov/41550040/",
  "study_type": "Randomized Controlled Trial",
  "title": "Evaluating placebo responses to intranasal oxytocin in autism: findings from the placebo lead-in phase of a randomised controlled trial.",
  "trust_tier": 2,
  "trust_tier_label": "Randomized Controlled Trial",
  "year": 2026
}
