{
  "abstract": "INTRODUCTION: Autism Spectrum Disorder (ASD) impacts children's functioning and participation. Functionality-centered interventions, such as the Global Integration Method (Método de Integração Global-MIG), have been proposed in this context. Understanding parental perceptions is relevant to evaluate their effects on children's daily lives. Objective: To explore parental perceptions of changes in functioning following participation in the MIG program among children with Autism Spectrum Disorder (ASD), interpreted through the framework of the International Classification of Functioning, Disability and Health (ICF).\nMETHODS: This qualitative study was conducted as an embedded component of an ongoing randomized controlled trial evaluating outcomes associated with participation in the MIG program in children with ASD. Parents of children allocated to the intervention group (n = 18; aged 6-12 years), diagnosed with ASD and classified at support levels I and II, participated in three post-intervention focus groups.\nRESULTS: Findings were organized into three categories: previous experiences with conventional interventions, perceived changes following participation in MIG, and general perceptions of the program. Parents described previous interventions as fragmented, difficult to access, and associated with inconsistent functional experiences. Following participation in MIG, caregivers reported perceived changes related to body functions, particularly motor and communicative aspects, as well as changes in daily activities and social and school participation. Parents also described positive experiences regarding program organization, family support, and expectations regarding future participation and autonomy.\nCONCLUSION: Parents reported perceived changes in functioning following participation in MIG and described positive experiences related to the intervention process.",
  "age_max": 12,
  "age_min": 6,
  "age_range": "6-12 years",
  "age_unit": "years",
  "authors": [
    "Reinaldo da Costa Paulino Netto",
    "Deisiane Oliveira Souto",
    "Iolanda Costa Rodrigues",
    "Amanda Aparecida Alves Cunha Nascimento",
    "Camila de Oliveira Schumann",
    "Millene Cézar Nunes",
    "Ana Clara Schaper Fernandes",
    "Ana Clara de Carvalho Silva",
    "Patricia Aparecida Neves Santana",
    "Thalita Karla Flores Cruz"
  ],
  "clinical_implications": "Parents reported perceived changes in functioning following participation in MIG and described positive experiences related to the intervention process.",
  "co_occurring_conditions": [],
  "conclusion": "Parents reported perceived changes in functioning following participation in MIG and described positive experiences related to the intervention process.",
  "created_at": "2026-08-10T07:28:06Z",
  "diagnosis": "Autism Spectrum Disorder",
  "doi": "10.3389/fpubh.2026.1851875",
  "domain": "motor",
  "duration": null,
  "easy_explainer": {
    "conclusion": "The researchers concluded: \"Parents reported perceived changes in functioning following participation in MIG and described positive experiences related to the intervention process.\"",
    "design": "This was a randomised controlled trial — people were assigned to treatments by chance, which is the most reliable way to tell whether a treatment itself caused a change.",
    "disclaimer": "This is a plain-language summary of one paper's abstract, not medical advice. Talk to your child's clinician before changing anything.",
    "duration": null,
    "not_stated": [
      "how long the study ran"
    ],
    "size": "The number of people who took part is not stated in this record, so the result cannot be judged on size."
  },
  "intervention": "family",
  "journal": "Frontiers in public health",
  "keywords": [
    "autism spectrum disorder",
    "family",
    "functioning",
    "motor activity",
    "psychomotor performance"
  ],
  "last_updated": "2026-08-31T13:10:30Z",
  "limitations": [
    "Extracted from abstract only; full-text methods and risk-of-bias details were not reviewed."
  ],
  "mesh_terms": [
    "Humans",
    "Child",
    "Autism Spectrum Disorder",
    "Parents",
    "Male",
    "Female",
    "Qualitative Research",
    "Focus Groups"
  ],
  "participants": null,
  "pmid": "42491294",
  "primary_outcomes": [
    "Findings were organized into three categories: previous experiences with conventional interventions, perceived changes following participation in MIG, and general perceptions of th…"
  ],
  "secondary_outcomes": [],
  "source_url": "https://pubmed.ncbi.nlm.nih.gov/42491294/",
  "study_type": "Randomized Controlled Trial",
  "title": "\"My child before and now\": parental perceptions of changes in functioning following participation in the global integration method (Método de Integração Global) in children with autism spectrum disorder.",
  "trust_tier": 2,
  "trust_tier_label": "Randomized Controlled Trial",
  "year": 2026
}
