{
  "abstract": "For Cognitive Behavioral Therapy to best meet the specific needs of autistic youth with co-occurring anxiety and to continue to grow as a sustainable treatment option, it is important to incorporate caregiver perspectives and feedback. Data were drawn from a randomized controlled trial and included 148 caregivers of autistic youth (ages 7-13 years, M = 9.89, SD = 1.79; 23% female; 77.7% White) with co-occurring anxiety disorders randomized to one of two active treatment conditions (Coping Cat, n = 72, or Behavioral Interventions for Anxiety in Children with Autism [BIACA], n = 76). A systematic inductive thematic analysis was used to code open-ended parent responses on the Consumer Satisfaction Questionnaire to identify what caregivers of autistic children with co-occurring anxiety liked most and least about their child's treatment. Satisfaction with treatment was high (M = 64.98, SD = 5.48). Caregivers' most-liked treatment features across treatments included (a) tools and coping skills, (b) therapeutic alliance, (c) caregiver support and involvement, (d) personalized treatment, and (e) treatment efficacy. Least-liked features of treatment and family participation included (a) the commute to the clinic, (b) treatment length, (c) commitment required at home, (d) questionnaires, and (e) scheduling. Treatment responders endorsed therapeutic alliance more frequently. Caregivers in BIACA endorsed caregiver support and involvement at higher rates, in addition to commitment required at home. Caregiver responses indicated a preference for more sessions and highlighted the importance of balancing need for caregiver involvement in treatment while reducing caregiver burden.",
  "age_max": 13,
  "age_min": 7,
  "age_range": "7-13 years",
  "age_unit": "years",
  "authors": [
    "Lesley A Norris",
    "Jonathan C Rabner",
    "Marika Marklin",
    "Margaret E Crane",
    "Kathrin Renschler",
    "Emma Jenkins",
    "Joshua Kemp",
    "Eric A Storch",
    "Jeffrey J Wood",
    "Connor M Kerns",
    "Adam B Lewin",
    "Brent J Small",
    "Philip C Kendall"
  ],
  "clinical_implications": "May be relevant to Cognitive behavioral therapy in Autism Spectrum Disorder, based on abstract-reported findings.",
  "co_occurring_conditions": [
    "Anxiety Disorders"
  ],
  "conclusion": null,
  "created_at": "2026-08-10T07:28:06Z",
  "diagnosis": "Autism Spectrum Disorder",
  "doi": "10.1007/s10803-025-06725-y",
  "domain": "general",
  "duration": null,
  "easy_explainer": {
    "conclusion": "The abstract does not include a conclusions section, so this page does not state what the researchers concluded.",
    "design": "This was a randomised controlled trial — people were assigned to treatments by chance, which is the most reliable way to tell whether a treatment itself caused a change.",
    "disclaimer": "This is a plain-language summary of one paper's abstract, not medical advice. Talk to your child's clinician before changing anything.",
    "duration": null,
    "not_stated": [
      "how long the study ran"
    ],
    "size": "It involved 148 people, a reasonably sized group for this kind of research."
  },
  "intervention": "Cognitive behavioral therapy",
  "journal": "Journal of autism and developmental disorders",
  "keywords": [
    "Cognitive behavioral therapy",
    "Exposure therapy",
    "Mixed methods",
    "Systematic inductive thematic analysis",
    "Treatment satisfaction",
    "Youth anxiety"
  ],
  "last_updated": "2026-08-31T13:10:29Z",
  "limitations": [
    "Extracted from abstract only; full-text methods and risk-of-bias details were not reviewed."
  ],
  "mesh_terms": [
    "Humans",
    "Female",
    "Adolescent",
    "Caregivers",
    "Child",
    "Male",
    "Cognitive Behavioral Therapy",
    "Anxiety Disorders",
    "Autistic Disorder",
    "Personal Satisfaction",
    "Patient Satisfaction",
    "Coping Skills",
    "Parents",
    "Autism Spectrum Disorder",
    "Surveys and Questionnaires"
  ],
  "participants": 148,
  "pmid": "39930281",
  "primary_outcomes": [],
  "secondary_outcomes": [],
  "source_url": "https://pubmed.ncbi.nlm.nih.gov/39930281/",
  "study_type": "Randomized Controlled Trial",
  "title": "Caregiver Satisfaction with Anxiety Treatment for Autistic Youth: A Mixed Methods Examination.",
  "trust_tier": 2,
  "trust_tier_label": "Randomized Controlled Trial",
  "year": 2026
}
